pmid,title,authors,journal,date,abstract,references,citedin,five
25967622,On-orbit characterization of the VIIRS solar diffuser and solar diffuser screen.,"Sun, Junqiang J|Wang, Menghua M",Applied optics,2015 Jan 10,"We analyze bidirectional reflectance factors (BRF) of the solar diffuser (SD) and vignetting function (VF) of the SD screen (SDS) for on-board calibration of the visible infrared imaging radiometer suite (VIIRS). Specific focus is placed on the products of the BRF and VF, which are the main inputs for calibration of the SD and its accompanying solar diffuser stability monitor (SDSM), which tracks SD degradation. A set of 14 spacecraft yaw maneuvers for the Suomi National Polar-Orbiting Partnership satellite, which houses the VIIRS instrument, was carefully planned and carried out over many orbits to provide the necessary information on the dependence of VIIRS instrument response on solar angles. Along with the prelaunch measurements for the SDS VF and SD BRF, the absolute form of the BRF-VF product is determined for each of the reflective solar bands (RSB) and the SDSM detectors. Consequently, the absolute form of the SDS VF also is obtained from the RSB and SDSM detectors using the yaw maneuver data. The results show that the BRF-VF product for an RSB is independent of the detector, gain status, and half-angle mirror side. The derived VFs from the RSB and the SDSM detectors also show reasonable agreement with each other, as well as with the prelaunch VF measurements, and further demonstrate only geometrical dependence, which, in this work, is characterized by solar angles. The derived calibration coefficients, called the F-factors, from the application of the derived functions in this study show a significantly improved pattern. A small band-dependent residual seasonal fluctuation on the level of âˆ¼0.2%-0.4% remains in the F-factors for each RSB and is further improved by a corrective function with linear dependence on the solar azimuth angle in the nominal attitude instrument coordinate system to the VF. For satellite ocean color remote sensing, on-orbit instrument calibration and characterization are particularly important for producing accurate and consistent ocean color products. The result of this work has the most significant and direct impact on ocean color products.",,,26368755|30117902|25608208|27505382|25968375
32825258,FY-3D MERSI On-Orbit Radiometric Calibration from the Lunar View.,"Wu, Ronghua R|Zhang, Peng P|Xu, Na N|Hu, Xiuqing X|Chen, Lin L|Zhang, Lu L|Yang, Zhongdong Z","Sensors (Basel, Switzerland)",2020 Aug 20,"Limited by the on-orbital calibration capability, scaling the measured radiance in accuracy and stability is challenging for the Earth observation satellites in the reflective solar bands (RSBs). Although the lunar calibration is a well-developed technique in the RSBs, limited work has been done for Chinese Earth observation satellites. To improve the on-orbital calibration performance, the advanced MEdium Resolution Spectral Imager (MERSI II), which is the primary payload of the fourth satellite of the Fengyun 3 Series (FY-3D), expands the space view angle of the imager in order to capture better lunar images. In this study, we propose an absolute radiometric calibration method based on the FY-3D/MERSI lunar observation data. A lunar irradiance model named ROLO/GIRO has been used together with the necessary data procedures, including dark current count estimation, single pixel irradiance calculation, and full disk lunar irradiance calculation. The calibration coefficients obtained by the lunar calibration are compared with the pre-launch laboratory calibration. The results show that the deviations between the two calibration procedures are in a reasonable range in general. However, a relatively high non-linear response was found in the low energy incidence for some detectors, which leads to the large deviation in the corresponding bands. This study explored an ideal and independent method to validate MERSI on-orbit radiometric performance. The lunar calibration practiced for MERSI also gave a valuable example that can be recommended to the other Chinese Earth observation satellites.",23262612|30461732,33379278,33379278|23016343|30461732|28117745|33916016
12371544,Long-term temporal stability of the National Institute of Standards and Technology spectral irradiance scale determined with absolute filter radiometers.,"Yoon, Howard W HW|Gibson, Charles E CE",Applied optics,2002 Oct 01,"The temporal stability of the National Institute of Standards and Technology (NIST) spectral irradiance scale as measured with broadband filter radiometers calibrated for absolute spectral irradiance responsivity is described. The working standard free-electron laser (FEL) lamps and the check standard FEL lamps have been monitored with radiometers in the ultraviolet and the visible wavelength regions. The measurements made with these two radiometers reveal that the NIST spectral irradiance scale as compared with an absolute thermodynamic scale has not changed by more than 1.5% in the visible from 1993 to 1999. Similar measurements in the ultraviolet reveal that the corresponding change is less than 1.5% from 1995 to 1999. Furthermore, a check of the spectral irradiance scale by six different filter radiometers calibrated for absolute spectral irradiance responsivity based on the high-accuracy cryogenic radiometer shows that the agreement between the present scale and the detector-based scale is better than 1.3% throughout the visible to the near-infrared wavelength region. These results validate the assigned spectral irradiance of the widely disseminated NIST or NIST-traceable standard sources.",,27366615,12371545|18319808|27805142|22945145|18354571
25608208,Visible Infrared Imaging Radiometer Suite solar diffuser calibration and its challenges using a solar diffuser stability monitor.,"Sun, Junqiang J|Wang, Menghua M",Applied optics,2014 Dec 20,"The reflective solar bands (RSB) of the Visible Infrared Imaging Radiometer Suite (VIIRS) on board the Suomi National Polar-orbiting Partnership (SNPP) satellite is calibrated by a solar diffuser (SD) whose performance is itself monitored by a solar diffuser stability monitor (SDSM). In this study, we describe the calibration algorithm of the SDSM, analyze the current two and a half years of calibration data, and derive the performance result for the SD, commonly called SD degradation or H-factors. The application of the newly derived vignetting functions for both the SD screen and the SDSM sun-view screen effectively removes the seasonal oscillations in the derived SD degradation and significantly improves the quality of the H-factors. The full illumination region, the so-called ""sweet spot,"" for both SD view and SDSM sun view is carefully examined and selected to ensure a consistent and an optimal number of valid data samples to reduce the sample noise owing to inconsistent or lack of samples. The result shows that SD degrades much faster at short wavelength as expected, about 28.5% at 412 nm but only 1.2% at 935 nm up to date. The performance of the SD degrades exponentially with time until 7 November 2013 but has since become flat. This sudden flattening of the SD degradation is a new phenomenon never previously observed for the degradations of the SD on VIIRS or other satellite sensors. The overall result shows that SDSM is essentially functioning without flaws in catching the on-orbit degradation of the SD. The most significant and direct impact of this work would be on the quality of the ocean color products that depend sensitively on moderate RSB (RSB) (M1-M8, M10, and M11). Two very important and key questions on the performance of the SD are also raised. One pertains to the directional dependence of the SD degradation result, and it is shown that the SD does not degrade uniformly in all directions as has been assumed by all SD calibration analyses. This has a definitive impact on the RSB calibration. Another is on the degradation of the SD at the shortwave infrared (SWIR) wavelengths, and it is shown that the zero degradation input for the RSB calibration would be erroneous. Last, the impact of the stray light on the SD since ""first light"" is cleanly exhibited in the improved SD degradation result.",,,26368755|25967622|27505382|30117902|25968375
27889622,Evaluating UV-C LED disinfection performance and investigating potential dual-wavelength synergy.,"Beck, Sara E SE|Ryu, Hodon H|Boczek, Laura A LA|Cashdollar, Jennifer L JL|Jeanis, Kaitlyn M KM|Rosenblum, James S JS|Lawal, Oliver R OR|Linden, Karl G KG",Water research,2017 Feb 01,"A dual-wavelength UV-C LED unit, emitting at peaks of 260 nm, 280 nm, and the combination of 260|280 nm together was evaluated for its inactivation efficacy and energy efficiency at disinfecting Escherichia coli, MS2 coliphage, human adenovirus type 2 (HAdV2), and Bacillus pumilus spores, compared to conventional low-pressure and medium-pressure UV mercury vapor lamps. The dual-wavelength unit was also used to measure potential synergistic effects of multiple wavelengths on bacterial and viral inactivation and DNA and RNA damage. All five UV sources demonstrated similar inactivation of E. coli. For MS2, the 260 nm LED was most effective. For HAdV2 and B. pumilus, the MP UV lamp was most effective. When measuring electrical energy per order of reduction, the LP UV lamp was most efficient for inactivating E. coli and MS2; the LP UV and MP UV mercury lamps were equally efficient for HAdV2 and B. pumilus spores. Among the UV-C LEDs, there was no statistical difference in electrical efficiency for inactivating MS2, HAdV2, and B. pumilus spores. The 260 nm and 260|280 nm LEDs had a statistical energy advantage for E. coli inactivation. For UV-C LEDs to match the electrical efficiency per order of log reduction of conventional LP UV sources, they must reach efficiencies of 25-39% or be improved on by smart reactor design. No dual wavelength synergies were detected for bacterial and viral inactivation nor for DNA and RNA damage.",26971809|16386286|26967007|24946032|18988100|12772961|26030683|23668964|26712541|16295846|20375477|21220143|19081599|25506761|26825005|21131511|17933932|19872573|13978804|21115187|12587128|19431332|16907802|24266597|12324370,34804780|34785646|34683555|34495736|34465056|34321542|34111204|34091221|33658595|33022467|32855026|32650492|32582873|32551537|31275622|30690218|30610077|30315076|29920077|29778790,29986239|30893742|26888599|19205767|30317042|29195159
23262612,On-orbit calibration of SeaWiFS.,"Eplee, Robert E RE|Meister, Gerhard G|Patt, Frederick S FS|Barnes, Robert A RA|Bailey, Sean W SW|Franz, Bryan A BA|McClain, Charles R CR",Applied optics,2012 Dec 20,"Ocean color climate data records (CDRs) require water-leaving radiances with 5% absolute and 1% relative accuracies as input. Because of the amplification of any sensor calibration errors by the atmospheric correction, the 1% relative accuracy requirement translates into a 0.1% long-term radiometric stability requirement for top-of-the-atmosphere (TOA) radiances. The rigorous prelaunch and on-orbit calibration program developed and implemented for Sea-viewing Wide Field-of-view Sensor (SeaWiFS) by the NASA Ocean Biology Processing Group (OBPG) has led to the incorporation of significant changes into the on-orbit calibration methodology over the 13-year lifetime of the instrument. Evolving instrument performance and ongoing algorithm refinement have resulted in updates to approaches for the lunar, solar, and vicarious calibration of SeaWiFS. The uncertainties in the calibrated TOA radiances are addressed in terms of accuracy (biases in the measurements), precision (scatter in the measurements), and stability (repeatability of the measurements). The biases are 2%-3% from lunar calibration and 1%-2% from vicarious calibration. The precision is 0.16% from solar signal-to-noise ratios, 0.13% from lunar residuals, and 0.10% from vicarious gains. The long-term stability of the TOA radiances, derived from the lunar time series, is 0.13%. The stability of the vicariously calibrated TOA radiances, incorporating the uncertainties of the in situ measurements and the atmospheric correction, is 0.30%. This stability of the radiometric calibration of SeaWiFS over its 13-year on-orbit lifetime has allowed the OBPG to produce CDRs from the ocean color data set.",,32825258|32704331|29276312,17676117|18364980|18364981|25968375|21221136
33643774,"The impact of far-UVC radiation (200-230 nm) on pathogens, cells, skin, and eyes - a collection and analysis of a hundred years of data.","Hessling, Martin M|Haag, Robin R|Sieber, Nicole N|Vatter, Petra P",GMS hygiene and infection control,2021,"Background: The ongoing coronavirus pandemic requires new disinfection approaches, especially for airborne viruses. The 254 nm emission of low-pressure vacuum lamps is known for its antimicrobial effect, but unfortunately, this radiation is also harmful to human cells. Some researchers published reports that short-wavelength ultraviolet light in the spectral region of 200-230 nm (far-UVC) should inactivate pathogens without harming human cells, which might be very helpful in many applications. Methods: A literature search on the impact of far-UVC radiation on pathogens, cells, skin and eyes was performed and median log-reduction doses for different pathogens and wavelengths were calculated. Observed damage to cells, skin and eyes was collected and presented in standardized form. Results: More than 100 papers on far-UVC disinfection, published within the last 100 years, were found. Far-UVC radiation, especially the 222 nm emission of KrCl excimer lamps, exhibits strong antimicrobial properties. The average necessary log-reduction doses are 1.3 times higher than with 254 nm irradiation. A dose of 100 mJ/cm2 reduces all pathogens by several orders of magnitude without harming human cells, if optical filters block emissions above 230 nm. Conclusion: The approach is very promising, especially for temporary applications, but the data is still sparse. Investigations with high far-UVC doses over a longer period of time have not yet been carried out, and there is no positive study on the impact of this radiation on human eyes. Additionally, far-UVC sources are unavailable in larger quantities. Therefore, this is not a short-term solution for the current pandemic, but may be suitable for future technological approaches for decontamination in rooms in the presence of people or for antisepsis.",1791495|17758687|32222977|29986239|16560850|33186680|25506761|31811032|25495690|22226954|19869399|11464748|19872839|33471372|1798752|19120918|13058381|17933932|5957928|13183931|26712541|28225654|32927421|28039742|25846917|32785216|24146947|30610077|19762061|29101868|6201948|19146982|24266597|30952663|29466457|19872573|30947566|32547908|19912558|31027771|29480719|6729034|31077510|23571376|16295846|11079695|15748635|3538070|32896604|13325398|22591268|32220842|3791231|6053866|30265926|20024789|32581288|3097682|32033948|19431332|19870293|30044862|13750383|7271457|27935054|32243946|30096188|27275949|4784265|29426899|18913643|3786457|7871151,34315976|33809879,33465817|34495736|32581288|29426899|32046660
34475608,"Design, calibration, and application of a cryogenic low-background infrared radiometer for spectral irradiance and radiance measurements from 4 μm to 20 μm wavelength.","Kaplan, Simon G SG|Woods, Solomon I SI|Shirley, Eric L EL|Carter, Adriaan C AC|Jung, Timothy M TM|Proctor, James E JE|Sears, Dale R DR|Zeng, Jinan J","Optical engineering (Redondo Beach, Calif.)",2021,"We have constructed, calibrated, and tested a cryogenic low-background infrared radiometer for both spectral radiance and irradiance measurements over the 4 μm to 20 μm wavelength range. The primary purpose of the Missile Defense Transfer Radiometer (MDXR) is to measure absolute irradiance or radiance from cryogenic infrared test chamber sources using a photoconductive Si:As Blocked Impurity Band (BIB) detector and a set of spectral filters. The MDXR also includes an absolute cryogenic radiometer (ACR) and a Fourier transform spectrometer (FTS). For irradiance measurements, the ACR is used to provide the primary power scale for the BIB detector in conjunction with spectral filters, while the FTS/BIB configuration derives its scale from an internal blackbody source. The two measurement scales show agreement for the irradiance of highly collimated (< 1 mrad) infrared beams from 10-13 W/μm/cm2 to 10-8 W/μm/cm2 within the combined relative uncertainties of 2.6 % (coverage factor k = 1.) We have also calibrated the radiometer for radiance measurements by using a large cavity fluid bath blackbody that overfills the spatial and angular extent of the radiometer entrance pupil. The radiometric calibration uncertainty analysis of the radiometer as well as its maintenance and stability are discussed.",15751676|20531920|26233351|29400755,,26233354|12371545|24922428|15751676|30278699
34495736,"UV Inactivation of SARS-CoV-2 across the UVC Spectrum: KrCl* Excimer, Mercury-Vapor, and Light-Emitting-Diode (LED) Sources.","Ma, Ben B|Gundy, Patricia M PM|Gerba, Charles P CP|Sobsey, Mark D MD|Linden, Karl G KG",Applied and environmental microbiology,2021 10 28,"Effective disinfection technology to combat severe acute respiratory syndrome coronavirus 2 (SARS-CoV-2) can help reduce viral transmission during the ongoing COVID-19 global pandemic and in the future. UV devices emitting UVC irradiation (200 to 280 nm) have proven to be effective for virus disinfection, but limited information is available for SARS-CoV-2 due to the safety requirements of testing, which is limited to biosafety level 3 (BSL3) laboratories. In this study, inactivation of SARS-CoV-2 in thin-film buffered aqueous solution (pH 7.4) was determined across UVC irradiation wavelengths of 222 to 282 nm from krypton chloride (KrCl*) excimers, a low-pressure mercury-vapor lamp, and two UVC light-emitting diodes. Our results show that all tested UVC devices can effectively inactivate SARS-CoV-2, among which the KrCl* excimer had the best disinfection performance (i.e., highest inactivation rate). The inactivation rate constants of SARS-CoV-2 across wavelengths are similar to those for murine hepatitis virus (MHV) from our previous investigation, suggesting that MHV can serve as a reliable surrogate of SARS-CoV-2 with a lower BSL requirement (BSL2) during UV disinfection tests. This study provides fundamental information on UVC's action on SARS-CoV-2 and guidance for achieving reliable disinfection performance with UVC devices. IMPORTANCE UV light is an effective tool to help stem the spread of respiratory viruses and protect public health in commercial, public, transportation, and health care settings. For effective use of UV, there is a need to determine the efficiency of different UV wavelengths in killing pathogens, specifically SARS-CoV-2, to support efforts to control the ongoing COVID-19 global pandemic and future coronavirus-caused respiratory virus pandemics. We found that SARS-CoV-2 can be inactivated effectively using a broad range of UVC wavelengths, and 222 nm provided the best disinfection performance. Interestingly, 222-nm irradiation has been found to be safe for human exposure up to thresholds that are beyond those effective for inactivating viruses. Therefore, applying UV light from KrCl* excimers in public spaces can effectively help reduce viral aerosol or surface-based transmissions.",25506761|33533250|33380727|28225654|28657725|22458545|29986239|33022467|32798217|24266597|30044862|17474029|29261289|33737536|31038919|33484873|26712541|27889622|32763344|33749837|32896604|32182409|17822117|32581288|27175354,,34668746|33807470|34452302|32581288|33799842|29959245|33484873|32763344
17933932,Enhanced UV inactivation of adenoviruses under polychromatic UV lamps.,"Linden, Karl G KG|Thurston, Jeanette J|Schaefer, Raymond R|Malley, James P JP",Applied and environmental microbiology,2007 Dec,"Adenovirus is recognized as the most UV-resistant waterborne pathogen of concern to public health microbiologists. The U.S. EPA has stipulated that a UV fluence (dose) of 186 mJ cm(-2) is required for 4-log inactivation credit in water treatment. However, all adenovirus inactivation data to date published in the peer-reviewed literature have been based on UV disinfection experiments using UV irradiation at 253.7 nm produced from a conventional low-pressure UV source. The work reported here presents inactivation data for adenovirus based on polychromatic UV sources and details the significant enhancement in inactivation achieved using these polychromatic sources. When full-spectrum, medium-pressure UV lamps were used, 4-log inactivation of adenovirus type 40 is achieved at a UV fluence of less than 60 mJ cm(-2) and a surface discharge pulsed UV source required a UV fluence of less than 40 mJ cm(-2). The action spectrum for adenovirus type 2 was also developed and partially explains the improved inactivation based on enhancements at wavelengths below 230 nm. Implications for water treatment, public health, and the future of UV regulations for virus disinfection are discussed.",11464748|12324370|12514044|16151167,33643774|33383557|32752793|27889622|27783334|26712541|26506431|25799963|25106777|24487537|24031326|21131511|20851976|18978087|18424543,24266597|18460414|19700823|23040991|16386286
30117902,On-orbit characterization of the VIIRS solar diffuser and attenuation screens for NOAA-20 using yaw measurements.,"Sun, Junqiang J|Chu, Mike M|Wang, Menghua M",Applied optics,2018 Aug 01,"The follow-up visible infrared imaging radiometer suite (VIIRS) housed in the NOAA-20 satellite and the first of four in the NOAA Joint Polar Satellite System satellite series, was launched on 18 November 2017. The on-orbit satellite yaw maneuver operation was carried out on 25-26 January 2018 over 15 scheduled orbits to obtain responses of the reflective solar bands (RSBs) and the solar diffuser stability monitor (SDSM) over a specified angular range. This paper presents a comprehensive analysis of the yaw measurements that characterizes the three required input functions for the standard on-orbit RSB calibration pipeline. The characterization functions of the product of the bidirectional reflectance factors (BRFs) of the solar diffuser (SD) with the vignetting function (VF) of the SD screen (SDS), dubbed the BRF-VF-products (BVPs), are derived for the two required outgoing directions from the SD, one set for the RSB BVPs from the SD to the rotation telescope assembly that directs light to the RSBs, and another set for the SDSM BVPs for the outgoing direction from the SD to the SDSM. The VFs for the attenuation screen placed in front of the Sun-view port, the Sun-view screen (SVS), are analyzed as a set of standalone functions to characterize the direct solar illumination reaching the SDSM through the SVS, but the complexity of their non-smooth two-dimensional dependence requires an additional direct treatment in the derivation of the degradation of the SD, the H-factors. The results for the RSB BVPs, SDSM BVPs, and the SVS VFs are presented and discussed, and further applied to derive the early-mission performance of H-factors and the RSB calibration coefficients, or F-factors. The overall results of the H-factors and F-factors showing smooth trends with negligible residuals indicate that the derived BVP functions and the SVS VFs have been accurately characterized or treated, and are ready for use for the standard on-orbit RSB calibration of NOAA-20 VIIRS.",,,25967622|26368755|32400576|25608208|27505382
16295846,Spectral sensitivity of Bacillus subtilis spores and MS2 coliphage for validation testing of ultraviolet reactors for water disinfection.,"Mamane-Gravetz, Hadas H|Linden, Karl G KG|Cabaj, Alexander A|Sommer, Regina R",Environmental science & technology,2005 Oct 15,"The microbicidal UV fluence under polychromatic radiation from UV lamps is typically measured using the DNA absorbance spectrum as a weighting factor for the relative wavelength effectiveness. However, this DNA-based weighting does not necessarily match the spectral sensitivity of the microorganism being tested. Bacillus subtilis spores are often used for UV reactor validation in Europe, while MS2 coliphage is typically used for validation testing in the United States. These organisms were exposed to quasi-monochromatic UV irradiation across the microbicidal spectrum at wavelengths of 214, 230, 240, 254, 265, 280, and 293 nm. MS2 was three times more sensitive to wavelengths near 214 nm compared to the 254 nm output of low-pressure lamps, while B. subtilis spores were most sensitive to wavelengths around 265 nm. Use of these action spectra, compared to the DNA-based weighting, resulted in differences in the calculated polychromatic UV fluence. Consequently, the action spectrum, which is specific for each microorganism, has implications on the uncertainty of UV fluence determination during validation of reactors with polychromatic UV lamps.",,33643774|31275622|31236005|30123980|30047962|27889622|27498232|26712541|24952878|22327583,19762061|27014964|25506761|26712541|1798752
