pmid,title,authors,journal,date,abstract,references,citedin,five
27661568,Monochromatic measurements of the JPSS-1 VIIRS polarization sensitivity.,"McIntire, Jeff J|Moyer, David D|Brown, Steven W SW|Lykke, Keith R KR|Waluschka, Eugene E|Oudrari, Hassan H|Xiong, Xiaoxiong X",Applied optics,2016 Sep 20,"Polarization sensitivity is a critical property that must be characterized for spaceborne remote sensing instruments designed to measure reflected solar radiation. Broadband testing of the first Joint Polar-orbiting Satellite System (JPSS-1) Visible Infrared Imaging Radiometer Suite (VIIRS) showed unexpectedly large polarization sensitivities for the bluest bands on VIIRS (centered between 400 and 600 nm). Subsequent ray trace modeling indicated that large diattenuation on the edges of the bandpass for these spectral bands was the driver behind these large sensitivities. Additional testing using the National Institute of Standards and Technology's Traveling Spectral Irradiance and Radiance Responsivity Calibrations Using Uniform Sources was added to the test program to verify and enhance the model. The testing was limited in scope to two spectral bands at two scan angles; nonetheless, this additional testing provided valuable insight into the polarization sensitivity. Analysis has shown that the derived diattenuation agreed with the broadband measurements to within an absolute difference of about 0.4% and that the ray trace model reproduced the general features of the measured data. Additionally, by deriving the spectral responsivity, the linear diattenuation is shown to be explicitly dependent on the changes in bandwidth with polarization state.",16161668|17068565|26836861,,27661594|27410156|31503597|25968375|27607649
27879830,Inter-Comparison of ASTER and MODIS Surface Reflectance and Vegetation Index Products for Synergistic Applications to Natural Resource Monitoring.,"Miura, Tomoaki T|Yoshioka, Hiroki H|Fujiwara, Kayo K|Yamamoto, Hirokazu H","Sensors (Basel, Switzerland)",2008 Apr 08,"Synergistic applications of multi-resolution satellite data have been of a great interest among user communities for the development of an improved and more effective operational monitoring system of natural resources, including vegetation and soil. In this study, we conducted an inter-comparison of two remote sensing products, namely, visible/near-infrared surface reflectances and spectral vegetation indices (VIs), from the high resolution Advanced Thermal Emission and Reflection Radiometer (ASTER) (15 m) and lower resolution Moderate Resolution Imaging Spectroradiometer (MODIS) (250 m - 500 m) sensors onboard the Terra platform. Our analysis was aimed at understanding the degree of radiometric compatibility between the two sensors' products due to sensor spectral bandpasses and product generation algorithms. Multiple pairs of ASTER and MODIS standard surface reflectance products were obtained at randomly-selected, globally-distributed locations, from which two types of VIs were computed: the normalized difference vegetation index and the enhanced vegetation indices with and without a blue band. Our results showed that these surface reflectance products and the derived VIs compared well between the two sensors at a global scale, but subject to systematic differences, of which magnitudes varied among scene pairs. An independent assessment of the accuracy of ASTER and MODIS standard products, in which ""in-house"" surface reflectances were obtained using in situ Aeronet atmospheric data for comparison, suggested that the performance of the ASTER atmospheric correction algorithm may be variable, reducing overall quality of its standard reflectance product. Atmospheric aerosols, which were not corrected for in the ASTER algorithm, were found not to impact the quality of the derived reflectances. Further investigation is needed to identify the sources of inconsistent atmospheric correction results associated with the ASTER algorithm, including additional quality assessments of the ASTER and MODIS products with other atmospheric radiative transfer codes.",,28777329|28245566,28777329|21942048|28903278|24287529|29892137
33114888,Onboard absolute radiometric calibration and validation of the satellite calibration spectrometer on HY-1C.,"Xu, He-Yu HY|Zhang, Li-Ming LM|Huang, Wen-Xin WX|Xu, Wei-Wei WW|Si, Xiao-Long XL|Chen, Hong-Yao HY|Li, Xin X|Song, Qing-Jun QJ",Optics express,2020 Sep 28,"As the reference radiometric calibration standard of sensors on the Haiyang-1C (HY-1C) satellite platform, the satellite calibration spectrometer (SCS) is equipped with an onboard calibration system composed of double solar diffusers and an erbium-doped diffuser to monitor the postlaunch radiometric response change. Herein, through onboard calibration data analysis, the calibration diffuser performance remains stable without degradation, and the Moderate Resolution Imaging Spectroradiometer (MODIS) on Terra is adopted as a reference to repeatedly verify onboard radiometric calibration results by selecting different dates and reflectance scenes. The SCS equivalent reflectance is obtained by combining the mean digital number (DN) of the SCS crossing area image with the radiometric calibration coefficient. The spectral reflectance is obtained via interpolation and iteration, which is adopted as the actual MODIS incident pupil spectral reflectance because the small imaging time interval can be ignored and almost vertically observed, and it is convoluted with the MODIS spectral response function to obtain the predicted equivalent reflectance. Validation is completed by comparing the predicted MODIS equivalent reflectance to the measured value based on the onboard calibration coefficient. The results show that (1) the difference between the measured and predicted MODIS band equivalent reflectance is between -0.00466 and 0.0039, and (2) the percentage difference between the measured and predicted MODIS band equivalent reflectance ranges from 4.17% and 1.24%, indicating that the calibration system carried on HY-1C can perform high-precision SCS radiometric calibration, meeting the cross-calibration accuracy requirements of other loads on the same platform.",,,28117745|28777329|27505382|24287529|32365984|32742051
18216962,Aircraft measurements for calibration of an orbiting spacecraft sensor.,"Hovis, W A WA|Knoll, J S JS|Smith, G R GR",Applied optics,1985 Feb 01,None,,32601509|26601030,25979747|14242213|21186209|15273356|27529244
18323952,Changes in the Radiometric sensitivity of SeaWiFS determined from lunar and solar-based measurements.,"Barnes, R A RA|Eplee, R E RE|Patt, F S FS|McClain, C R CR",Applied optics,1999 Jul 20,"We report on the lunar and solar measurements used to determine the changes in the radiometric sensitivity of the Sea-viewing Wide Field-of-view Sensor (SeaWiFS). Radiometric sensitivity is defined as the output from the instrument (or from one of the instrument bands) per unit spectral radiance at the instrument's input aperture. Knowledge of the long-term repeatability of the SeaWiFS measurements is crucial to maintaining the quality of the ocean scenes derived from measurements by the instrument. For SeaWiFS bands 1-6 (412-670 nm), the change in radiometric sensitivity is less than 0.2% for the period from November 1997 through November 1998. For band 7 (765 nm), the change is approximately 1.5% and for band 8 (865 nm) approximately 5%. The rates of change of bands 7 and 8, which were linear with time for the first eight months of lunar measurements, are now slowing. The scatter in the data points about the trend lines in this analysis is less than 0.3% for all eight SeaWiFS bands. These results are based on monthly measurements of the moon. Daily solar measurements using an onboard diffuser show that the radiometric sensitivities of the SeaWiFS bands have changed smoothly during the time intervals between lunar measurements. Because SeaWiFS measurements have continued past November 1998, the results presented here are considered as a snapshot of the instrument performance as of that date.",,,18364980|18354559|15540442|12665094|25968375
32020954,Characterization of Landsat-7 to Landsat-8 reflective wavelength and normalized difference vegetation index continuity.,"Roy, D P DP|Kovalskyy, V V|Zhang, H K HK|Vermote, E F EF|Yan, L L|Kumar, S S SS|Egorov, A A",Remote sensing of environment,2016 Jan 12,"At over 40 years, the Landsat satellites provide the longest temporal record of space-based land surface observations, and the successful 2013 launch of the Landsat-8 is continuing this legacy. Ideally, the Landsat data record should be consistent over the Landsat sensor series. The Landsat-8 Operational Land Imager (OLI) has improved calibration, signal to noise characteristics, higher 12-bit radiometric resolution, and spectrally narrower wavebands than the previous Landsat-7 Enhanced Thematic Mapper (ETM+). Reflective wavelength differences between the two Landsat sensors depend also on the surface reflectance and atmospheric state which are difficult to model comprehensively. The orbit and sensing geometries of the Landsat-8 OLI and Landsat-7 ETM+ provide swath edge overlapping paths sensed only one day apart. The overlap regions are sensed in alternating backscatter and forward scattering orientations so Landsat bi-directional reflectance effects are evident but approximately balanced between the two sensors when large amounts of time series data are considered. Taking advantage of this configuration a total of 59 million 30m corresponding sensor observations extracted from 6,317 Landsat-7 ETM+ and Landsat-8 OLI images acquired over three winter and three summer months for all the conterminous United States (CONUS) are compared. Results considering different stages of cloud and saturation filtering, and filtering to reduce one day surface state differences, demonstrate the importance of appropriate per-pixel data screening. Top of atmosphere (TOA) and atmospherically corrected surface reflectance for the spectrally corresponding visible, near infrared and shortwave infrared bands, and derived normalized difference vegetation index (NDVI), are compared and their differences quantified. On average the OLI TOA reflectance is greater than the ETM+ TOA reflectance for all bands, with greatest differences in the near-infrared (NIR) and the shortwave infrared bands due to the quite different spectral response functions between the sensors. The atmospheric correction reduces the mean difference in the NIR and shortwave infrared but increases the mean difference in the visible bands. Regardless of whether TOA or surface reflectance are used to generate NDVI, on average, for vegetated soil and vegetation surfaces (0 ≤ NDVI ≤ 1), the OLI NDVI is greater than the ETM+ NDVI. Statistical functions to transform between the comparable sensor bands and sensor NDVI values are presented so that the user community may apply them in their own research to improve temporal continuity between the Landsat-7 ETM+ and Landsat-8 OLI sensor data. The transformation functions were developed using ordinary least squares (OLS) regression and were fit quite reliably (r 2 values >0.7 for the reflectance data and >0.9 for the NDVI data, p-values <0.0001).",16926910|19425097|20372238,34219822|34183663|33976255|33738573|33265435|32963240|32943798|32109951|31918454,32020955|21942048|15305688|29449747|26110405
25968375,On-orbit calibration of the Suomi National Polar-Orbiting Partnership Visible Infrared Imaging Radiometer Suite for ocean color applications.,"Eplee, Robert E RE|Turpie, Kevin R KR|Meister, Gerhard G|Patt, Frederick S FS|Franz, Bryan A BA|Bailey, Sean W SW",Applied optics,2015 Mar 10,"The NASA Ocean Biology Processing Group (OBPG) developed two independent calibrations of the Suomi National Polar-Orbiting Partnership (SNPP) Visible Infrared Imaging Radiometer Suite (VIIRS) moderate resolution reflective solar bands using solar diffuser measurements and lunar observations, and implemented a combined solar- and lunar-based calibration to track temporal changes in radiometric response of the instrument. Differences between the solar and lunar data sets have been used to identify issues and verify improvements in each. Linearization of the counts-to-radiance conversion yields a more consistent calibration at low radiance levels. Correction of a recently identified error in the VIIRS solar unit vector coordinate frame has been incorporated into the solar data and diffuser screen transmission functions. Temporal trends in the solar diffuser stability monitor data have been evaluated and addressed. Fits to the solar calibration time series show mean residuals per band of 0.067%-0.17%. Periodic residuals in the VIIRS lunar data are confirmed to arise from a wavelength-dependent libration effect for the sub-spacecraft point in the output of the U.S. Geological Survey Robotic Lunar Observatory photometric model of the Moon. Temporal variations in the relative spectral responses for each band have been assessed, and significant impact on band M1 (412 nm) lunar data has been identified and rectified. Fits to the lunar calibration time series, incorporating sub-spacecraft point libration corrections, show mean residuals per band of 0.069%-0.20%. Lunar calibrations have been used to adjust the solar-derived radiometric corrections for bands M1, M3, and M4. After all corrections, the relative differences in the solar and lunar calibrations for bands M1-M7 are 0.093%-0.22%. The OBPG has achieved a radiometric stability for the VIIRS on-orbit calibration that is commensurate with those achieved for SeaWiFS and Aqua MODIS, supporting the incorporation of VIIRS data into the long-term NASA ocean color data record.",,32818076|31380374|29933641|29276312,30461732|26368755|25967622|25608208|26560590
18364980,Calibration of SeaWiFS. I. Direct techniques.,"Barnes, R A RA|Eplee, R E RE|Schmidt, G M GM|Patt, F S FS|McClain, C R CR",Applied optics,2001 Dec 20,"We present an overview of the calibration of the Sea-viewing Wide Field-of View Sensor (SeaWiFS) from its performance verification at the manufacturer's facility to the completion of its third year of on-orbit measurements. These calibration procedures have three principal parts: a prelaunch radiometric calibration that is traceable to the National Institute of Standards and Technology; the Transfer-to-Orbit Experiment, a set of measurements that determine changes in the instrument's calibration from its manufacture to the start of on-orbit operations; and measurements of the sun and the moon to determine radiometric changes on orbit. To our knowledge, SeaWiFS is the only instrument that uses routine lunar measurements to determine changes in its radiometric sensitivity. On the basis of these methods, the overall uncertainty in the SeaWiFS top-of-the-atmosphere radiances is estimated to be 4-5%. We also show the results of comparison campaigns with aircraft- and ground-based measurements, plus the results of an experiment, called the Southern Ocean Band 8 Gain Study. These results are used to check the calibration of the SeaWiFS bands. To date, they have not been used to change the instrument's prelaunch calibration coefficients. In addition to these procedures, SeaWiFS is a vicariously calibrated instrument for ocean-color measurements. In the vicarious calibration of the SeaWiFS visible bands, the calibration coefficients are modified to force agreement with surface truth measurements from the Marine Optical Buoy, which is moored off the Hawaiian Island of Lanai. This vicarious calibration is described in a companion paper.",,28804228|28804202,18354559|23262612|18364981|18323952|12665095
32020955,Preliminary analysis of the performance of the Landsat 8/OLI land surface reflectance product.,"Vermote, Eric E|Justice, Chris C|Claverie, Martin M|Franch, Belen B",Remote sensing of environment,2016 Apr 28,"The surface reflectance, i.e., satellite derived top of atmosphere (TOA) reflectance corrected for the temporally, spatially and spectrally varying scattering and absorbing effects of atmospheric gases and aerosols, is needed to monitor the land surface reliably. For this reason, the surface reflectance, and not TOA reflectance, is used to generate the greater majority of global land products, for example, from the Moderate Resolution Imaging Spectroradiometer (MODIS) and Visible Infrared Imaging Radiometer Suite (VIIRS) sensors. Even if atmospheric effects are minimized by sensor design, atmospheric effects are still challenging to correct. In particular, the strong impact of aerosols in the Visible and Near Infrared spectral range can be difficult to correct, because they can be highly discrete in space and time (e.g., smoke plumes) and because of the complex scattering and absorbing properties of aerosols that vary spectrally and with aerosol size, shape, chemistry and density. This paper presents the Landsat 8 Operational Land Imager (OLI) atmospheric correction algorithm that has been developed using the Second Simulation of the Satellite Signal in the Solar Spectrum Vectorial (6SV) model, refined to take advantage of the narrow OLI spectral bands (compared to Thematic Mapper/Enhanced Thematic Mapper (TM/ETM+)), improved radiometric resolution and signal-to-noise. In addition, the algorithm uses the new OLI Coastal aerosol band (0.433-0.450μm), which is particularly helpful for retrieving aerosol properties, as it covers shorter wavelengths than the conventional Landsat, TM and ETM+ blue bands. A cloud and cloud shadow mask has also been developed using the ""cirrus"" band (1.360-1.390 μm) available on OLI, and the thermal infrared bands from the Thermal Infrared Sensor (TIRS) instrument. The performance of the surface reflectance product from OLI is analyzed over the Aerosol Robotic Network (AERONET) sites using accurate atmospheric correction (based on in situ measurements of the atmospheric properties), by comparison with the MODIS Bidirectional Reflectance Distribution Function (BRDF) adjusted surface reflectance product and by comparison of OLI derived broadband albedo from United States Surface Radiation Budget Network (US SURFRAD) measurements.",16926910|17579701|18449285,34770504|34750391|34650347|34579374|34545093|34504894|34430081|34357943|34327008|34219830|34219822|34203863|34183663|33976255|33876758|33435223|33343084|33293894|33228080|33182014|33158170|32963240|32704488|32704392|32661444|32187201|32076393|31967369|31918454|30989385,32020954|30142203|33154713|27879830|33114883
12665094,Reflectance-based calibration of SeaWiFS. I. Calibration coefficients.,"Barnes, Robert A RA|Zalewski, Edward F EF",Applied optics,2003 Mar 20,"We present a calibration approach for the Sea-Viewing Wide Field-of-View Sensor (SeaWiFS) based on the reflectance properties of the instrument's onboard diffuser. This technique uses SeaWiFS as a reflectometer, measuring the reflected solar irradiance from the Earth and from the onboard diffuser. Because the Sun is the common source of light for both measurements, the ratio of the SeaWiFS-measured radiances from the Earth and the diffuser provide the ratio for the reflectances of the two samples. The reflectance characterization of the onboard diffuser is the calibration reference for this approach. Knowledge of the value of the solar irradiance is not required for these measurements because it falls out of the ratio. Knowledge of the absolute calibration coefficient for the SeaWiFS measurements of each of the two samples is not required either. Instead, the result of the ratioing technique is based on the linearity of the instrument's response to the intensity of the input light. The calibration requires knowledge, however, of the reflectance of the onboard diffuser at the start of the SeaWiFS mission and the response of the instrument bands, in digital numbers, for measurements of the diffuser at that time.",,,12665095|17279164|18354559|18364980|18323952
33916016,Radiometric Calibration for a Multispectral Sensor Onboard RISESAT Microsatellite Based on Lunar Observations.,"Imai, Masataka M|Kurihara, Junichi J|Kouyama, Toru T|Kuwahara, Toshinori T|Fujita, Shinya S|Sakamoto, Yuji Y|Sato, Yuji Y|Saitoh, Sei-Ichi SI|Hirata, Takafumi T|Yamamoto, Hirokazu H|Takahashi, Yukihiro Y","Sensors (Basel, Switzerland)",2021 Apr 01,"Radiometric calibration utilizing the Moon as a reference source is termed as lunar calibration. It is a useful method for evaluating the performance of optical sensors onboard satellites orbiting the Earth. Lunar calibration provides sufficient radiometric calibration opportunities without requiring any special equipment, and is suitable for nano/microsatellites. This study applies lunar calibration to a multispectral sensor, Ocean Observation Camera (OOC), on board a microsatellite named Rapid International Scientific Experiment Satellite. Simulating the brightness of the Moon based on the RObotic Lunar Observatory and SELENE/Spectrum Profiler models, sensitivity degradation was proven to be negligible in any of the four spectral bands of the OOC with the sensor temperature correction. A bluing trend in the OOC's sensor sensitivity was revealed, indicating a shorter observation wavelength shows larger irradiance. Comparing the top-of-atmosphere reflectance of Railroad Valley Playa with the Radiometric Calibration Network dataset revealed that the derived calibration parameter from the lunar calibration was valid for correcting the bluing trend in the visible range. Although the lunar and vicarious calibration parameters for the infrared band were unexpectedly inconsistent, lunar calibration could potentially contribute toward estimating the contaminated background radiance in the Earth observation images.",18259337|30461732,,30461732|26900523|34613006|32825258|25968375
30461732,On-orbit radiometric calibration of Suomi NPP VIIRS reflective solar bands using the Moon and solar diffuser.,"Choi, Taeyoung T|Shao, Xi X|Cao, Changyong C",Applied optics,2018 Nov 10,"Radiometric calibration of the Suomi National Polar-orbiting Partnership Visible Infrared Imaging Radiometer Suite (VIIRS) reflective solar bands relies mainly on the onboard solar diffuser (SD) observations. The SD reflectance degrades over time due to the exposure to solar ultraviolet radiation. The uncertainties embedded in characterizing the SD bidirectional reflectance distribution function (BRDF) directly affect the accuracy of sensor radiometric calibration coefficients, such as F-factors, which are proxies of detector gain. The Moon-based radiometric calibration provides an independent way of validating and correcting the SD-based calibration. This study focuses on the comparison of the long-term SD F-factors with lunar F-factors by using two independent lunar irradiance models, i.e., Miller and Turner (MT) model and the Global Space-based Inter-Calibration System Implementation of ROLO (GIRO) model. To monitor the long-term detector response changes, the lunar F-factor differences are matched to the SD F-factors by applying the best fit scaling factors. Overall, the two lunar F-factors agree well, within 2% of one sigma standard deviation in the reflective solar bands compared to the SD F-factors. The lifetime standard deviations of difference between the GIRO-based lunar and SD F-factors show better long-term match than that of MT-based lunar F-factors. The GIRO-based lunar F-factors show increasing differences over time in comparison with the SD F-factors especially for bands M1 to M4, which indicates the underestimation of the VIIRS detector degradation by SD F-factors for these bands. Using standard SD calibration method and the GIRO-based lunar model, long-term difference between the lunar and SD F-factors shows there are 1.6%, 1.3%, 1.0%, and 0.9% increases in lunar F-factor trend for bands M1 to M4 at the end of year 2015. To mitigate these time-dependent biases, NOAA Ocean Color (OC) group and NASA VIIRS characterization support team (VCST) developed lunar correction methods and applied them to their specific products. However, the amounts of band-dependent lunar corrections are not consistent between these two teams, especially in the short-wavelength bands from M1 to M4, depending on the versions of lunar models and SD F-factor calculation algorithms. Using the standard SD F-factor algorithm and the multi-agency endorsed GIRO model, we derived lunar correction factors based on the quadratic fits between the SD and lunar F-factors. The differences with the NOAA OC group and NASA VCST team are compared and described in this study.",,33916016|32825258,25968375|26368755|27505382|25967622|26560590
